{
  "allow": [
    {
      "actions": [
        "book"
      ],
      "destinations": [
        "provider-16-05@example.test"
      ],
      "recipients": [
        "provider-16-05@example.test"
      ],
      "resources": [
        "itinerary-16-05"
      ],
      "tool": "finalize_travel"
    }
  ],
  "approval_rules": {
    "finalize_travel": {
      "bind_fields": [
        "resource",
        "amount"
      ],
      "required_issuer": "owner-16"
    }
  },
  "data_rules": {},
  "delegation": {
    "child_may_expand_authority": false,
    "max_depth": 0
  },
  "job_id": "job-case-180",
  "policy_id": "policy-case-180",
  "principal": "agentdojo-travel_booking-agent",
  "schema_version": 1
}
