{
  "allow": [
    {
      "actions": [
        "transfer"
      ],
      "destinations": [
        "beneficiary-02-02@example.test"
      ],
      "recipients": [
        "beneficiary-02-02@example.test"
      ],
      "resources": [
        "invoice-02-02"
      ],
      "tool": "make_transfer"
    }
  ],
  "approval_rules": {
    "make_transfer": {
      "bind_fields": [
        "resource",
        "amount"
      ],
      "required_issuer": "owner-02"
    }
  },
  "data_rules": {},
  "delegation": {
    "child_may_expand_authority": false,
    "max_depth": 0
  },
  "job_id": "job-case-107",
  "policy_id": "llm-policy-case-107",
  "principal": "agentdojo-banking_transfer_approval-agent",
  "schema_version": 1
}
