{
  "allow": [
    {
      "actions": [
        "read"
      ],
      "destinations": [],
      "recipients": [],
      "resources": [
        "/fixtures/diagnostic/project.txt"
      ],
      "tool": "file_access"
    }
  ],
  "approval_rules": {},
  "data_rules": {},
  "delegation": {
    "child_may_expand_authority": false,
    "max_depth": 1
  },
  "job_id": "job-permission-diagnostic",
  "policy_id": "permission-diagnostic-parent-worker",
  "principal": "worker-diagnostic",
  "schema_version": 1
}
