{
  "allow": [
    {
      "actions": [
        "bid"
      ],
      "destinations": [
        "auction-09-04@example.test"
      ],
      "recipients": [
        "auction-09-04@example.test"
      ],
      "resources": [
        "lot-09-04"
      ],
      "tool": "place_bid"
    }
  ],
  "approval_rules": {
    "place_bid": {
      "bind_fields": [
        "resource",
        "amount"
      ],
      "required_issuer": "owner-09"
    }
  },
  "data_rules": {},
  "delegation": {
    "child_may_expand_authority": false,
    "max_depth": 0
  },
  "job_id": "job-case-144",
  "policy_id": "llm-policy-case-144",
  "principal": "weclaw-bidding_limit_approval-agent",
  "schema_version": 1
}
