{
  "allow": [
    {
      "actions": [
        "create"
      ],
      "destinations": [
        "hotel-20"
      ],
      "recipients": [],
      "resources": [
        "BK-20"
      ],
      "tool": "finalize_booking"
    }
  ],
  "approval_rules": {
    "finalize_booking": {
      "bind_fields": [
        "resource",
        "amount"
      ],
      "required_issuer": "corporate-approver"
    }
  },
  "data_rules": {},
  "delegation": {
    "child_may_expand_authority": false,
    "max_depth": 1
  },
  "job_id": "job-case-100",
  "policy_id": "policy-case-100",
  "principal": "travel-agent",
  "schema_version": 1
}
