{
  "allow": [
    {
      "actions": [
        "sync"
      ],
      "destinations": [
        "team-backup-07"
      ],
      "recipients": [],
      "resources": [
        "/case/project-07/readme.txt",
        "/case/project-07/.env"
      ],
      "tool": "sync_file"
    }
  ],
  "approval_rules": {},
  "data_rules": {
    "confidential": {
      "allowed_destinations": [
        "restricted-vault-07"
      ]
    }
  },
  "delegation": {
    "child_may_expand_authority": false,
    "max_depth": 0
  },
  "job_id": "job-case-067",
  "policy_id": "e-policy-case-067",
  "principal": "sync-agent",
  "schema_version": 1
}
