{
  "allow": [
    {
      "actions": [
        "send"
      ],
      "destinations": [
        "care_team-14-04@example.test"
      ],
      "recipients": [
        "care_team-14-04@example.test"
      ],
      "resources": [
        "case-14-04"
      ],
      "tool": "send_clinical_summary"
    }
  ],
  "approval_rules": {},
  "data_rules": {
    "confidential": {
      "allowed_destinations": [
        "restricted-care_team-14-04"
      ]
    }
  },
  "delegation": {
    "child_may_expand_authority": false,
    "max_depth": 0
  },
  "job_id": "job-case-169",
  "policy_id": "llm-policy-case-169",
  "principal": "weclaw-clinical_disclosure-agent",
  "schema_version": 1
}
