{
  "allow": [
    {
      "actions": [
        "send"
      ],
      "destinations": [
        "owner-09@example.test"
      ],
      "recipients": [
        "owner-09@example.test"
      ],
      "resources": [
        "trip-09"
      ],
      "tool": "send_email"
    }
  ],
  "approval_rules": {},
  "data_rules": {},
  "delegation": {
    "child_may_expand_authority": false,
    "max_depth": 0
  },
  "job_id": "job-case-029",
  "policy_id": "e-policy-case-029",
  "principal": "mail-agent",
  "schema_version": 1
}
