{
  "allow": [
    {
      "actions": [
        "upload_release"
      ],
      "destinations": [
        "release-13.tar.gz"
      ],
      "recipients": [],
      "resources": [
        "org/assigned-13"
      ],
      "tool": "github_mutation"
    }
  ],
  "approval_rules": {},
  "data_rules": {},
  "delegation": {
    "child_may_expand_authority": false,
    "max_depth": 0
  },
  "job_id": "job-case-013",
  "policy_id": "e-policy-case-013",
  "principal": "repo-agent",
  "schema_version": 1
}
