{
  "allow": [
    {
      "actions": [
        "trade"
      ],
      "destinations": [
        "venue-20-04@example.test"
      ],
      "recipients": [
        "venue-20-04@example.test"
      ],
      "resources": [
        "order-20-04"
      ],
      "tool": "submit_trade"
    }
  ],
  "approval_rules": {},
  "data_rules": {},
  "delegation": {
    "child_may_expand_authority": false,
    "max_depth": 1
  },
  "job_id": "job-case-199",
  "policy_id": "llm-policy-case-199",
  "principal": "weclaw-trading_delegation-agent",
  "schema_version": 1
}
