{
  "allow": [
    {
      "actions": [
        "send"
      ],
      "destinations": [
        "owner-12@example.test",
        "partner-12@example.test"
      ],
      "recipients": [
        "owner-12@example.test",
        "partner-12@example.test"
      ],
      "resources": [
        "doc-12"
      ],
      "tool": "send_message"
    }
  ],
  "approval_rules": {},
  "data_rules": {
    "confidential": {
      "allowed_destinations": [
        "owner-12@example.test"
      ]
    }
  },
  "delegation": {
    "child_may_expand_authority": false,
    "max_depth": 0
  },
  "job_id": "job-case-052",
  "policy_id": "policy-case-052",
  "principal": "message-agent",
  "schema_version": 1
}
