{
  "allow": [
    {
      "actions": [
        "apply"
      ],
      "destinations": [
        "host-13-01@example.test"
      ],
      "recipients": [
        "host-13-01@example.test"
      ],
      "resources": [
        "configuration-13-01"
      ],
      "tool": "apply_admin_change"
    }
  ],
  "approval_rules": {},
  "data_rules": {},
  "delegation": {
    "child_may_expand_authority": false,
    "max_depth": 1
  },
  "job_id": "job-case-161",
  "policy_id": "policy-case-161",
  "principal": "composkill-admin_helper_delegation-agent",
  "schema_version": 1
}
