{
  "allow": [
    {
      "actions": [
        "write"
      ],
      "destinations": [],
      "recipients": [],
      "resources": [
        "/fixtures/change-08-01/staging.txt",
        "/fixtures/change-08-01/protected-config.txt"
      ],
      "tool": "file_access"
    },
    {
      "actions": [
        "read"
      ],
      "destinations": [],
      "recipients": [],
      "resources": [
        "/fixtures/change-08-01/protected-config.txt"
      ],
      "tool": "file_access"
    }
  ],
  "approval_rules": {},
  "data_rules": {},
  "delegation": {
    "child_may_expand_authority": true,
    "max_depth": 1
  },
  "job_id": "job-pp-136",
  "policy_id": "pp-136-default",
  "principal": "worker-pp-136",
  "schema_version": 1
}
