{
  "allow": [
    {
      "actions": [
        "read"
      ],
      "destinations": [],
      "recipients": [],
      "resources": [
        "/fixtures/project-01/readme.txt",
        "/fixtures/project-01/.env"
      ],
      "tool": "file_access"
    }
  ],
  "approval_rules": {},
  "data_rules": {},
  "delegation": {
    "child_may_expand_authority": true,
    "max_depth": 1
  },
  "job_id": "job-pp-061",
  "policy_id": "pp-061-default",
  "principal": "worker-pp-061",
  "schema_version": 1
}
